{
  "id": "60b98b58062f238eb166d12c",
  "checkItemStates": [],
  "closed": false,
  "dateLastActivity": "2021-06-04T02:10:57.197Z",
  "desc": "Updating description",
  "descData": {
    "emoji": {}
  },
  "dueReminder": null,
  "idBoard": "60b4542ff34e693aa42ced74",
  "idList": "60b455db13e5d41a9ac0176f",
  "idMembersVoted": [],
  "idShort": 6,
  "idAttachmentCover": null,
  "idLabels": [],
  "manualCoverAttachment": false,
  "name": "Updating Name Card",
  "pos": 81920,
  "shortLink": "PhnWTfq0",
  "isTemplate": false,
  "cardRole": null,
  "dueComplete": false,
  "due": null,
  "email": null,
  "labels": [],
  "shortUrl": "https://trello.com/c/PhnWTfq0",
  "start": null,
  "url": "https://trello.com/c/PhnWTfq0/6-updating-name-card",
  "cover": {
    "idAttachment": null,
    "color": null,
    "idUploadedBackground": null,
    "size": "normal",
    "brightness": "dark",
    "idPlugin": null
  },
  "idMembers": [],
  "badges": {
    "attachmentsByType": {
      "trello": {
        "board": 0,
        "card": 0
      }
    },
    "location": false,
    "votes": 0,
    "viewingMemberVoted": false,
    "subscribed": false,
    "fogbugz": "",
    "checkItems": 0,
    "checkItemsChecked": 0,
    "checkItemsEarliestDue": null,
    "comments": 0,
    "attachments": 0,
    "description": true,
    "due": null,
    "dueComplete": false,
    "start": null
  },
  "subscribed": false,
  "idChecklists": []
}